{
  "case_id": "M018",
  "source": {
    "name": "Source corroboration",
    "practice": "Intelligence analysis",
    "instrument": {
      "state": "A claim or event description is supported by one or more information sources whose accuracy, independence, or access may be uncertain.\n",
      "operation": "Compare the claim against other independently sourced information while assessing each source's credibility, access, dependence, and relevance.\n",
      "signal": "Independent sources converge on, contradict, or fail to support the same material features of the claim.\n",
      "inference": "Genuine convergence across credible independent sources increases support for the corroborated features, while contradiction or lack of independent support lowers confidence or identifies unresolved uncertainty.\n",
      "limit": "Sources may share an undisclosed common origin, copy one another, inherit the same bias or error, have unequal access, or converge because of common assumptions rather than independent observation. Multiple reports therefore do not automatically constitute independent evidence.\n"
    }
  },
  "target": {
    "domain": "investigative reporting",
    "question": "What can be established about whether the procurement award was steered toward a preferred bidder?",
    "evidence": [
      "Authored synthetic scenario; no claim about a real organization or person.",
      "Tender documents, independently interviewed panel members and email exports are available; copied reports are identified."
    ]
  },
  "mapping": {
    "state": "A preferred-bidder allegation has sources of varying access and independence.",
    "operation": "Compare each material allegation across documents and accounts, checking credibility, access, provenance and dependence.",
    "signal": "Independent accounts converge or conflict on changes in scoring and advance access.",
    "inference": "Increase support only for corroborated features and identify unresolved steering allegations.",
    "limit": "Common origins, copying, bias and unequal access can create false convergence."
  }
}
