{
  "case_id": "011",
  "source": {
    "name": "Regression bisection",
    "practice": "Software debugging and testing",
    "instrument": {
      "state": "An ordered sequence of revisions contains a transition in a reproducibly testable property, with at least one earlier state known not to have the property and one later state known to have it.\n",
      "operation": "Test an intermediate revision, use the result to discard the incompatible portion of the remaining history, and repeat the partition-and-test process until the transition is localized.\n",
      "signal": "Each tested revision is classified on one side or the other of the target property, progressively shrinking the interval that can contain the transition.\n",
      "inference": "Repeated elimination constrains the first revision associated with the observed change to the final unresolved boundary or commit.\n",
      "limit": "Flaky tests, unbuildable revisions, nonmonotonic behavior, multiple independent changes, interactions among revisions, or an incorrectly chosen good or bad endpoint can prevent unique localization or identify a boundary that is correlated with rather than solely causal of the behavior.\n"
    }
  },
  "target": {
    "domain": "Software regression debugging",
    "question": "Where in the ordered revision history did the reproducible regression first appear?",
    "evidence": [
      "The oldest endpoint passes and the newest fails. Repeated tests are stable and the property has one transition on the tested linear history."
    ]
  },
  "mapping": {
    "state": "Ordered revisions bracket a reproducible transition from pass to fail.",
    "operation": "At each step keep the more recently dated half of the remaining revisions without testing a midpoint; continue to one revision.",
    "signal": "The revision interval halves on every step.",
    "inference": "The single remaining revision is the first one with the property.",
    "limit": "The boundary need not be the sole cause; flaky tests, unbuildable revisions and multiple transitions invalidate particular eliminations."
  }
}
